,categoria,titulo,contenido,tags
269,Tendencias,Así están hoy los ex Menudo: Serie contará su historia en octubre,"En pocos días la “Menudomanía” recorrerá de nuevo Latinoamérica con la serie ""Súbete a mi moto"", la que se estrenará en streaming el 9 de octubre en Amazon Prime. Muchas de sus fans se preguntan cómo lucen y qué hacen actualmente los exintegrantes de Menudo.         View this post on Instagram           #menudopr #menudomania #menudo80 #grupomenudo #elfenomeno #edgardodiaz #menudo #puertorico A post shared by  MENUDO | MANIA | PR 🇵🇷 (@menudopr) on Oct 2, 2020 at 3:25am PDTEl grupo fue creado por Edgardo Díaz en 1977, en Puerto Rico, y causó furor en los años 80 y 90. Por él pasaron más de 30 integrantes. La serie contará en 15 capítulos la historia de esta famosa banda.Entre los primeros integrantes que enamoraron a las niñas y jóvenes de los 80 y 90 con temas como “Quiero ser”, “Súbete a mi moto”, “Claridad”, “Solo tú, solo yo” están: René Farrait, Xavier Serbia, Miguel Cancel, Johnny Lozada, Ricky Lozada, Charlie Massó, Ricky Martín; Roy y Robby Rosa.         View this post on Instagram           Formación de Menudo en 1981. #miguelcancel #johnnylozada #xavierserbia #renefarrait y #rickymelendez  Foto vía Radio Oasis #menudo #1981 A post shared by  Fans Menudo (@fans_menudo) on Jun 24, 2020 at 1:24pm PDT         View this post on Instagram           Buenas noches 😻❤❤ A post shared by  Menudo 🇵🇷🎵 (@grupo_menudo) on Jan 13, 2020 at 7:18pm PSTRicky Martin, el más famosoSin duda que el Menudo que más éxito alcanzó en el mundo artístico es Ricky Martín, de 48 años.Fue uno de los integrantes que más duró dentro de la banda puertorriqueña y a su salida del grupo se mantuvo en el ambiente musical. Ganador de múltiples premios internacionales, es filántropo. En 2010 se declaró gay y actualmente está casado y tiene cuatro hijos.         View this post on Instagram           Look at that #cheeky #smile 😍 #Young #RickyMartin during his #Menudo days 🤗🤩💕😘 A post shared by  Menudo Fan (@menudo.explosion) on Jun 8, 2018 at 7:09am PDT         View this post on Instagram           Visit my stories so you can read the article. Thank you @outmagazine #pausaplay #orbitalaudio  . 📸: @fei_bian  👔: @luxurylaw  💇🏻‍♂️: @thecooljoey A post shared by  Ricky Martin (@ricky_martin) on Aug 12, 2020 at 10:53am PDTRené, entrenador personalUno de los primeros Menudo que enamoraron a las jóvenes de los años 80 fue René Farrait, de 52 años, quien hoy es entrenador personal y recientemente ofrece clases de zumba con mucho éxito.Tras su salida del grupo incursionó como solista y formó parte de Proyecto M. En los últimos años ha participado en el reencuentro de la banda puertorriqueña con el Tour “Súbete a mi moto”.En un reciente post, René anunció que en 2021, 37 años después de su salida de Menudo, iniciará su tour “René, mi música”.         View this post on Instagram           En esta foto de 1983 fue la época donde se detuvo el tiempo para mi... Ahora en el 2021 (37 años después) continuamos con esta historia que quedó inconclusa... Por las razones que sean. Ahora llegó mi momento, llegó mi turno, ahora me toca a mí. Estoy listo! Muchísimas gracias por su amor y cariño durante tantos años, y lo más importante, por ESPERAR. Lo agradezco enormemente. Nos vemos pronto en RENÉ, MI MÚSICA (TOUR 2021). 🙌🏼👊🏼🤘🏼❤️🇵🇷🔥🔥🔥🔥#GraciasLoreAndreaYAnaPorLaFoto #RenéMiMúsicaTour2021 #RockAndRoll #53AndFit #ElAñoQueVieneEnTuPaís @bailandoamenudo @vivianfarrait @mfarrait23 @naiomifarrait @alana.farrait @adri_gonzalez85 @eclectikmgmt @grandeseventospr A post shared by  Rene Farrait (@renefarrait) on Sep 16, 2020 at 4:28pm PDT         View this post on Instagram           Saliendo del gym rumbo a... #RenéMiMúsicaTour2021 #RockAndRoll #53AndFit #MusicAndFitness @bailandoamenudo @irma.nieves40 @vivianfarrait @mfarrait23 @naiomifarrait @alana.farrait @adri_gonzalez85 @eclectikmgmt @grandeseventospr A post shared by  Rene Farrait (@renefarrait) on Sep 23, 2020 at 6:12pm PDTXavier, experto en finanzasAunque intentó seguir en el mundo de la música, Xavier Serbiá se hizo experto en finanzas y comentarista de economía en CNN en español.Ha contado que quizás la motivación por las finanzas le vino al ver las desigualdades de las economías de Latinoamérica y la pérdida de los recursos que ganó en Menudo.         View this post on Instagram           Xavier ❤😍 A post shared by  Menudo 🇵🇷🎵 (@grupo_menudo) on Jun 11, 2020 at 8:51am PDT         View this post on Instagram           Los veo en un rato por @despiertamerica A post shared by  Xavier Serbia (@xavierserbia) on Apr 29, 2020 at 2:27am PDTJohnny Lozada, presentador y humoristaOtro de los más antiguos Menudo es Johnny Lozada, de 52 años, a quien la sonrisa no le ha abandonado desde que salió del grupo.Exitoso presentador de televisión, sus Instagram está lleno de memes y bromas, está casado, tiene tres hijos, es abuelo y ante la pandemia se inventó un programa interactivo que se llama “Yo ni entiendo”.         View this post on Instagram           Buenoss diass 💕💕 A post shared by  Menudo 🇵🇷🎵 (@grupo_menudo) on Nov 30, 2019 at 6:23am PST         View this post on Instagram           Ya no tengo baby 😭 #feliz #cumpleaños #25 @thalialozada te amo gordita de mi amor 🥳🥳🎂 A post shared by  Johnny Lozada (@johnnylozada) on Sep 19, 2020 at 4:58pm PDTCharlie Massó, actor y cantanteCharlie Massó, hoy de 51 años, fue el sustituto de René en la primera etapa de Menudo. Continuó siendo cantante, ha incursionado como actor. Está casado.         View this post on Instagram           Una buena noche para enamorarse!! #felizsabado #yonovivosinti #notepeguesquetequemas #solista #2018 #cmasso A post shared by  Charlie Massó (@cmassooficial) on Jan 27, 2018 at 6:01pm PSTRobby Rosa, cantautorUno de los exintegrantes de Menudo que ha tenido una historia difícil es Robby Rosa o Draco Rosa, como es su nombre artístico actual. Ha sido compositor para artistas como Ricky Martin y Julio Iglesias. De 51 años, Robby sobrevivió al cáncer que padeció desde 2011. Actualmente es un exitoso cantautor.         View this post on Instagram           how #adorable is this? 😍 #CharlieMasso and #RobbyRosa during their #Menudo days 🤗🤩💕 A post shared by  Menudo Fan (@menudo.explosion) on Jun 27, 2018 at 7:20am PDT         View this post on Instagram           🛸 ⚡️ #music ⌁ #sonic ⌁ #love ⌁ #magic⌁ #newmusic ⌁ #art ⌁ #DRACOROSA⌁ #instamusic ⌁ #fuzz ⌁ #musically ⌁ #musiclife ⌁ #musician ⌁ #newlife ⌁ #tickingclock ⌁ #StatStory #meditation #phvxwestindies #phantomvoxstudios @montesagradoreserve A post shared by  Draco Rosa (@dracorosa) on Sep 16, 2020 at 3:09pm PDTRicky Meléndez, abogadoUno de los más recordados exMenudo es Ricky, de los hermanos Meléndez, los primeros integrantes de la agrupación. Es abogado, tiene 52 años y en los 90 participó en el “Reencuentro” de la agrupación puertorriqueña.         View this post on Instagram           @rickymelendezexmenudo #menudopr #menudomania #menudoforever #menudo80s A post shared by  MENUDO | MANIA | PR 🇵🇷 (@menudopr) on Oct 24, 2019 at 7:31pm PDT         View this post on Instagram           Oye @johnnylozada, ya llenaste el censo? #2020Census A post shared by  Ricky Meléndez (@rickymelendezofficial) on Jun 6, 2020 at 8:56am PDTRay Reyes, locutorRay Reyes estuvo en Menudo en los años 80. Hoy tiene 50 años, ha participado en Proyecto M junto a René y Johnny, en los años 90 participó en “El Reencuentro” de la banda con mucho éxito. En la actualidad es locutor, está divorciado y tiene dos hijos.         View this post on Instagram           @rayreyesleon  #menudo #menudomania #menudopr #menudo80s A post shared by  MENUDO | MANIA | PR 🇵🇷 (@menudopr) on Aug 8, 2019 at 1:57pm PDT         View this post on Instagram           By @rayleon9912 👈 #goodmorning  #gentemenuda #menudosforever #rayreyesleon #love 👍 A post shared by  MENUDO'SFOREVER (@menudosforever) on Aug 26, 2020 at 5:57am PDTMiguel Cancel, expolicíaUno de los cantantes emblemáticos de Menudo fue Miguel Cancel, de 52 años. Continuó como solista y formó parte del “Reencuentro” de la banda en 1998. Radicado en Miami, fue policía.         View this post on Instagram           #menudo80s #menudo #menudomania #menudopr A post shared by  MENUDO | MANIA | PR 🇵🇷 (@menudopr) on Jul 3, 2019 at 3:55pm PDT         View this post on Instagram           Miguel Cancel, volvía en 2012 como solista con el tema ""Volver a ti"". Foto vía Lucirbien.com #miguelcancel #exmenudo #2012 #volverati A post shared by  Fans Menudo (@fans_menudo) on May 28, 2020 at 1:22pm PDT         View this post on Instagram           Esperando el tour ""Subete a mi moto""🛵🎤🎵 #miguelcancel #johnnylozada #rickymelendez #rayreyes #renefarrait #puertorico #elreencuentro #menuditis #menudo A post shared by  Menudo Reencuentro fans (@menudo_reencuentro) on Jul 3, 2019 at 11:31pm PDT         View this post on Instagram           ""Es por amor"", es una de las canciones que forman el disco ""15 años despues"" con ""El reencuentro"", publicado en el año 1998. Con los exmenudos #renefarrait #rayreyes #charliemasso #johnnylozada #miguelcancel y #rickymelendez  Foto vía Pinterest  #esporamor #15añosdespues #elreencuentro #exmenudos #1998. A post shared by  Fans Menudo (@fans_menudo) on Aug 11, 2020 at 1:30pm PDT",['Famosos']
270,Tendencias,Emme Muñiz Lopez: La prodigiosa voz de la hija de Jennifer Lopez y Marc Anthony,"Emme Maribel Muñiz, de 12 años, la hija deJennifer Lopezy Mac Anthonyes digna heredera de sus talentos. Deslumbró al mundo el 2 de febrero de 2020 cuando acompañó a su madre en el medio tiempo delSuper Bowl, pero no era la primera vez que se subía a un escenario a cantar.JLo está orgullosa de su pequeña, quien nació el 22 de febrero de 2008 junto a su hermanoMaximilian David Anthony.En el Mes de la Herencia Hispana, la “Diva del Bronx” y Emme son consideradas un ejemplo para la comunidad latina en los Estados Unidos y la cantante presume de ello en sus redes sociales.Con un emotivo mensaje de empoderamiento, JLo compartió tres momentos únicos donde su hija hizo gala de su prodigiosa voz. En el post se destacan su participación en el Super Bowl, un ensayo con su coach de canto y un concierto de su gira mundial “It's My Party”.“Todo lo que quiero que sepan mis niñas, las niñas en el escenario conmigo y en todo el mundo, es cómo usar sus voces y estar orgullosas de todo lo que son”, escribió Jennifer Lopez un día después de su presentación con Shakira en Miami.         View this post on Instagram           ♥️♥️♥️ Repost from @enews • Let E! introduce you to that generational greatness. 👏#HispanicHeritageMonth (📷: Getty) A post shared by  Jennifer Lopez (@jlo) on Sep 15, 2020 at 12:15pm PDTLa voz de la hija de JLo y Marc AnthonySu presentación en 2019 cantando “Limitless” y “Titanium”, de la compositora SIA, maravilló a los fans de Jennifer Lopez que asistieron a su concierto en Los Ángeles. Madre e hija lucieron un vestido de tul rojo de Versace y Emme apareció en el escenario para conmover al público y a JLo.Pero fue durante su intervención en el espectáculo deportivo la que tuvo resonancia mundial, ya que fue una combinación perfecta entre talento y un poderoso mensaje. Emme pudo desplegar su talento, como el de Marc Anthony.LATINASSSSS #SuperBowlHalftimeShow pic.twitter.com/gZpWTFrmR9— 𝙹𝚒𝚖𝙺𝚊𝚝𝚘𝚋𝚎𝚛⁷ (@edouardmantae) February 3, 2020La pequeña encabezó un coro de niñas que interpretó una versión del sencillo “Let's get loud”, uno de los temas emblema de su madre. Pero además cantó en solitario un verso de la mítica canción deBruce Springsteen,“Born in the U.S.A”.Los fans de Jennifer Lopez y Marc Anthony están enamorados de su hija y así lo expresan en las redes sociales cuando ellos comparten sus logros. “¡Emme nos ha hecho sentir tan orgullosos! Gracias por mostrarnos cómo usar nuestras voces”; “Es tan cómo usted Jen, tiene la voz y todo”; son algunos de los mensajes.","['Jennifer Lopez', 'Famosos']"
271,Tendencias,"""Mes de las estrellas"": Evento virtual reunirá a destacados expertos de la ciencia y astronomía","Como “Mes de las estrellas” fue denominada la serie de actividades de carácter astronómico y cultural que se desarrollarán durante octubre, bajo la organización de la municipalidad de Vicuña, en la región de Coquimbo.Este evento, cuyas actividades se efectuarán a través de plataformas virtuales, contará con la presencia de destacados expertos nacionales como María Teresa Ruíz, José Maza y Mario Hamuy; todos galardonados con el Premio Nacional de Ciencias Exactas.También estará presente el físico y divulgador científico español Javier Santaolalla, cuyos canales en Youtube tienen millones de suscriptores.Los organizadores de “Mes de las estrellas” señalaron que este es “el evento más importante de divulgación astronómica de Chile y América Latina”.¿Cuándo es el evento?Las actividades se desarrollarán desde este martes 6 y hasta el sábado 31 de octubre.Para conocer más detalles sobre el evento, puedes visitar el sitio turismovicuna.cl y sus redes sociales.",['José Maza']
272,Tendencias,Lele Pons se adelanta al Halloween y muestra cinco trajes de terror,"La influencer venezolana, Lele Pons, es experta en hacer estallar las redes sociales y así lo hizo al adelantarse al Halloween para mostrar a sus fans los trajes de terror que lució el año pasado. Su objetivo: conocer su opinión sobre su favorito y quizás mejorar sus opciones para este inusual 2020.“Vuelve el mes de Halloween... retrocediendo al año pasado, ¿cuál fue tu favorito?”, preguntó Lele Pons a sus más de 42 millones de seguidores en Instagram.         View this post on Instagram           HALLOWEEN MONTH IS BACK... throwback to last year 🎃💀 (which was your favorite) A post shared by  Lele Pons (@lelepons) on Oct 2, 2020 at 10:57am PDTLa influencer venezolana acompañó la pregunta de cinco fotos: vestida con el disfraz de Joker, Maléfica, novia zombie, Rapunzel y porrista desquiciada, siendo el de “Maléfica” uno de los que más gustó.“Mi favorita es el Joker”, “Brutal”, “Hermosa, “Rapunzel”, “Todos son asombrosos“, “Maléfica”, “Todo te queda hermoso”, “Joker”, “Grandiosa”, “Me gustan todos”, fueron algunos de los cientos de comentarios que recibió la publicación y que superó el millón de likes en pocas horas.“Se te nota”Lele Pons agradeció a sus seguidores esta semana por el apoyo a su sencillo “Se te nota”, que canta con Guaynaa, porque “está llegando a las listas mundiales. ¡Ni siquiera puedo expresar con palabras lo feliz que estoy ahora!”, escribió en su red social mostrando la aceptación del tema         View this post on Instagram           “SE TE NOTA” hitting the worldwide charts🔥🔥🔥 IM SCREAMINGGGG OMG... can’t even put into words how happy I am right now !! Thank you to my incredible team @johnny @sammy @interscope and to all my supporters for all the love! Shoutout to @guaynaa for being the best of the best and for believing in this song ! ❤️🙏🏼🙏🏼LETS GOOOO ""SE TE NOTA"" llego a los charts mundiales🔥🔥🔥 ESTOY GRITANDOOOO OMG ... ¡¡Ni siquiera puedo expresar con palabras lo feliz que estoy ahora !! ¡Gracias a mi increíble equipo @johnny @sammy @interscope y a todos mis seguidores por todo el amor! ¡ Un Shoutout a @guaynaa por ser el mejor de los mejores y por creer en esta canción! ❤️🙏🏼🙏🏼VAMOSSSS A post shared by  Lele Pons (@lelepons) on Sep 27, 2020 at 12:08pm PDT",['Famosos']
273,Tendencias,"¿Qué es la nueva ""miniluna"" que orbitará a la Tierra durante ocho meses?","Desde este mes de octubre, la Tierra ya no estará acompañada solamente por la Luna, sino que también poseerá una nueva y pequeña “miniluna” que estará junto a nuestro planeta por alrededor de ocho meses.Como “miniluna” se conoce a ciertos objetos que son retenidos temporalmente en la órbita de la Tierra, permaneciendo por meses o años, y que luego son liberados continuando con su trayectoria por el espacio.Una ""miniluna"" especialSegún informa la revista Science Alert, situaciones similares se produjeron entre los años 2006 y 2007 y entre 2018 y 2020 cuando dos asteroides fueron atraídos por la masa de nuestro planeta, quedándose en órbita por un tiempo.Esta nueva “miniluna”, denominada como 2020 SO, sin embargo, no tiene las mismas características que los otros dos asteroides capturados, ya que ni siquiera se trataría de un objeto natural, sino que sería completamente artificial y creado por el hombre.¿Qué es 2020 SO?Tras observar que su órbita es atípica y que viaja a una velocidad mucho más lenta de lo normal, los expertos llegaron a la conclusión que 2020 SO sería basura espacial, específicamente fragmentos del cohete Centaur, el cual llevó a la misión Surveyor 2 hacia la Luna en 1966.“Tienes que seguir rastreando estas cosas, o simplemente puedes perderlas de vista con mucha facilidad. Y si hacen algo un poco impredecible y miras hacia el lado equivocado, entonces no sabes hacia dónde se han ido. Es bastante sorprendente la cantidad de cosas que se han perdido”, explicó al respecto la arqueóloga espacial Alice Gorman, de la Universidad Flinders de Australia.Asteroid 2020 SO may get captured by Earth from Oct 2020 - May 2021. Current nominal trajectory shows shows capture through L2, and escape through L1. Highly-chaotic path, so be prepared for lots of revisions as new observations come in. @renerpho @nrco0e https://t.co/h4JaG2rHEd pic.twitter.com/RfUaeLtEWq— Tony Dunn (@tony873004) September 20, 2020Según una base de datos de la NASA, este objeto, que estará orbitando a la Tierra desde octubre y hasta mayo del próximo año, mide entre 6,4 y 14 metros de largo.Esta “miniluna” tendrá dos aproximaciones máximas al planeta, las que se registrarán el 1 de diciembre de este año, cuando se acerque a unos 50.000 kilómetros de distancia, y el 2 de febrero del 2021, cuando pase a 220.000 kilómetros.",['NASA']
274,Tendencias,"Denise Rosenthal sobre actuación de Carabineros: ""Esta institución requiere cambios urgentes''","La cantante nacional,Denise Rosenthal,se refirió al actuar de Carabineros tras la caída de un joven de16 años desde el puente Pío Nono al Río Mapocho, durante una manifestación.La artista utilizó su cuenta de Instagram para escribir sobre el tema, red social donde además de compartir su música comenta distintas situaciones.En sus ''stories'', la intérprete de ""Agua Segura""expresó: “No se puede justificar una actitud, una reacción de esta índole. Está totalmente desproporcionada”.En la misma línea, la también actriz destacó que “esta institución requiere cambios urgentes, donde Carabineros tengan, no sé, al menos una preparación sicológica, cultural.Por último, Rosenthal, quien acumula más de 3 millones de seguidores en su cuenta, concluyó:""Así no puede seguir"".¿Cómo sucedieron los hechos?El hecho se produjo en medio de manifestaciones que se desarrollaron en Plaza Italia y algunos otros sectores aledaños a ese lugar.En ese contexto, el adolescente, que fue golpeado por un Carabinero para posteriormente caer al río Mapocho, resultó confractura bilateral de muñeca, además de untraumatismo encéfalo craneano cerradoen evolución, segúnreportó la Clínica Santa María, donde está internado.Ante esta situación, el Gobiernoordenó el sábado a Carabinerosseparar a funcionario involucrado, el que en horas de esa misma tardefue detenido.Por su parte,el GeneralEnrique Monrás Álvarez, anombre de la institución uniformada,expuso que ""lo que digo de esta lamentable acción, es que ahí hubo una detención. Al intentar detenerlo, la persona cae, si fue empujado o cayó solo, eso lo verá el Ministerio Público... Para mí elfuncionario intentó detenerlo y la persona pierde el equilibrio y cae"".","['Denise Rosenthal', 'Carabineros']"
275,Tendencias,"""El Puma"" entrevista a Evaluna y usa un bigote para parecerse a Camilo: El colombiano reacciona","En la serie de entrevistas ""El Puma Live"", que realiza el famoso cantante venezolano José Luis Rodríguez,conversó con Evaluna Montaner, con quien compartió casi una hora. El veterano intérprete bromeó con la joven al colocarse un bigote e imitar a Camilo.""Qué guapo, te queda muy bien"", fue la reacción entre risas de la hija de Ricardo Montaner.Pero el propio Camilo también opinó sobre la imitación que hacía ""El Puma"" Rodríguez de él. ""Ey que bien te queda ese bigote"", dijo el colombiano, apareciendo repentinamente en la transmisión.A juicio de ""El Puma"", Camilo es ""el Dalí de la música"", una denominación que hace en referencia al artista plástico español Salvado Dalí, famoso además por su excéntrico bigote.         View this post on Instagram           Queridos @evaluna y @camilo, gracias por regalarme una noche tan maravillosa. Verlos es inspiración pura, sigan abonando y cultivando ese amor bonito, puro y sincero que tanto disfrutamos verles todos los que los queremos. Me llenaron el alma con esa conversación, que el Señor me los bendiga. Y Camilo, ya tengo el bigote, solo falta que cantemos #TuTu A post shared by  José Luis Rodríguez EL PUMA (@elpumaoficial) on Oct 1, 2020 at 5:43pm PDT""Eres un creativo, un pintor de la música"", dijo Rodríguez para describir a Camilo, además como el “Dalí de la música por su carisma, amor y gentileza”. El reconocido intérprete no dudó, incluso, enmanifestar su interés de cantar el tema ""El Tutu"" con el colombiano.[Entrevista""El Puma"" ha estado realizando entrevistas en vivo a través de Instagram, donde ha conversado con varios artistas como Soledad Pastorutti, Yuri, Adamaris López, Catherine Fulop, entre otras personalidades.En esta ocasión, el intérprete charló con la menor de los Montaner, con quien compartió detalles de su prominente carrera, su familia y su futuro como productora, ámbito en el que ya ha dado pasos importantes.También conversaron de la labor filantrópica que ejerce Evaluna con su familia a través de la fundación ""La ventana de los cielos"", para ayudar a los niños con capacidades especiales.Más noticias de Camilo y Evaluna","['Espectáculos', 'José Luis Rodríguez', 'Camilo Echeverry Evaluna Montaner']"
276,Tendencias,El papel que hizo famosa a Aracely Arámbula y que era de Adamari López,"En los años 90, Adamari López brillaba en la actuación. En su Puerto Rico natal era una estrella y de allí fue a México, para consolidar su carrera como actriz de telenovelas. Pero no todo sería fácil para la exesposa de Luis Fonsi.En una entrevista con el agente Joe Bonilla, reveló cómo fueron sus inicios en México. Acudió a Televisa para una audición para la telenovela “Pueblo chico, infierno grande”, protagonizada por Verónica Castro.“Hice casting con Aracely Arámbula y con Irán Castillo, dos de las figuras que ya estaban cotizando en México”, recordó Adamari López. Las mexicanas eran egresadas del Centro de Educación Artística de Televisa (CEA).Por ello, estaba convencida de “que las iban a mirar más a ellas, porque eran egresadas del CEA. A mí no me conocían”.         View this post on Instagram           Lindo #tb de @adamarilopez con @aracelyarambula 😍💕 A post shared by  Adamari Lopez Fans (@adamarilopezt) on Sep 26, 2020 at 9:35am PDTSin embargo, ella fue la escogida para representar el papel de Leonarda Ruán joven, la protagonista.“A mí me dieron el papel. Yo llegué a tomar clases en el CEA, empecé las clases de capacitación para suavizar mi acento puertorriqueño y neutralizarlo. Me hicieron un cambio de imagen... Estaban empezando a hacer el trámite porque entendían que el papel era mío”, le contó a Bonilla.Veto a Adamari LópezSin embargo, su felicidad quedó congelada cuando días después le preguntaron si ella era una de las actrices que participaba en la telenovela “Señora Tentación”, protagonizada por Lucía Méndez y transmitida por TV Azteca.“Al darse cuenta de este conflicto de intereses, me pidieron que me retirara de inmediato del canal y le dieron el papel a Aracely Arámbula”, explicó Adamari López a Bonilla en la transmisión en vivo.“Aparecer en la otra cadena te convertía automáticamente en una especie de persona non grata. Esa experiencia me hizo bajar de las nubes con un solo trueno. Lloré muchísimo”, confesó.Pero todo cambió tras una reestructuración en Televisa y la actriz puertorriqueña logró entrar en uno de sus proyectos. En diciembre de 1997 se estrenó “Sin ti”, su primera telenovela mexicana. Al año siguiente, brilló como la villana de “Camila” junto a Eduardo Capetillo y Bibi Gaytán.","['Aracely Arámbula', 'Famosos']"
