,categoria,titulo,contenido,tags
96,Deportes,Colo Colo cae como local ante Huachipato y profundiza la crisis: Revisa la tabla de posiciones,"Este sábado, Colo Colo sumó una nueva derrota en el Torneo Nacional al perder por 1-0 como local ante Huachipato, en un encuentro válido por la decimotercera fecha de la competencia.En el Estadio Monumental, los albos acumularon otra frustración en el campeonato local, donde no han ganado un solo partido de los cinco disputados en el regreso del fútbol tras la suspensión por la pandemia de coronavirus.¡Final del partido! El Cacique cayó por la mínima ante Huachipato. Colo-Colo 0-1 @Huachipato#VamosColoColo 🤟— Colo-Colo (Desde 🏡) (@ColoColo) October 3, 2020El Cacique no levanta cabezaAl igual que en los otros compromisos, el cuadro dirigido por Gualberto Jara evidenció un juego poco profundo y sin generar mayores acciones de peligro en la portería rival.En esa dinámica, el gol de los acereros se produjo tras una falta penal cometida por el defensor albo Felipe Campos en contra de Nicolás Ramírez.El encargado de ejecutar el penal fue Claudio Sepúlveda (55’), quien decretó la ventaja definitiva para el cuadro visitante.En la zona roja de la tablaCon este resultado, Colo Colo se mantiene con nueve puntos en la penúltima ubicación de la tabla de posiciones, solo superando al colista Deportes La Serena.El Cacique, ahora, queda a la espera de la confirmación de su nuevo técnico, que sería el argentino nacionalizado boliviano Gustavo Quinteros, cuyo arribo ya habría sido aprobado por el directorio de Blanco y Negro.Huachipato, en tanto, con esta victoria suma 18 puntos y se instala en la medianía de la clasificación.Revisa la tabla de posiciones","['Colo Colo', 'Torneo Nacional']"
97,Deportes,Otro menos en La Roja: Cuerpo técnico libera a Fabián Orellana por lesión,"La Selección Chilena liberó a un nuevo miembro del equipo, el que se alista para los duelos clasificatorios ante Uruguay y Colombia, los que se disputarán el 8 y 13 de octubre, respectivamente.Ahora el hombre que no estará en el complejo Juan Pinto Durán es Fabián Orellana, según reportó la ANFP en un comunicado.¿Qué se dijo?“La Gerencia de Comunicaciones de la Federación de Fútbol de Chile informa que el Cuerpo Médico de la Selección Chilena liberó al jugador Fabián Orellana de la convocatoria para los partidos por Eliminatorias ante Uruguay y Colombia”, se señaló.Además, se informó que “la decisión fue adoptada debido a que los Servicios Médicos del Club Real Valladolid han informado que Orellana presenta una lesión muscular de muslo izquierdo, cuyo plazo de recuperación informado excede el ciclo de partidos de Eliminatorias”.La baja de Orellana se suma a otras que ha anunciado el “Equipo de Todos”, como la de Claudio Bravo y Andrés Vilches.","['Selección Chilena', 'Clasificatorias Sudamericanas']"
98,Deportes,Gustavo Quinteros será el nuevo técnico de Colo Colo: Decisión unánime del directorio,"Gustavo Quinteros será el nuevo entrenador de Colo Colo. Y es que la mañana de este sábado se llevó a cabo una sesión extraordinaria del directorio, donde se aprobó esa medida de forma unánime.Ahora el gerente deportivo del club popular, Marcelo Espina, deberá sellar su fichaje, algo que está bastante avanzado desde la salida de Mario Salas.Quinteros, que dirigió a la UC en el país, pero cuyo último destino fue el Tijuana de México, debería llegar la próxima semana a Santiago.Este fichaje marcará el fin del proceso -que comenzó como interinato- de Gualberto Jara, quien conducirá su último partido con el plantel de honor de los albos esta tarde (18:30 horas) frente a Huachipato.Colo Colo, que aún tiene chances de clasificar a la segunda ronda de Copa Libertadores, pero que está en las últimas plazas del Torneo Nacional, muestra un bajo nivel futbolístico.",['Colo Colo']
99,Deportes,La mansión hospital donde estaría Schumacher: Afirman que no habla y se comunica con sus ojos,"El 30 de diciembre de 2013 el mundo del deporte se remeció con el accidente que protagonizó el séptuple campeón de Fórmula Uno, Michael Schumacher, tras sufrir un accidente cuando esquiaba en los Alpes franceses, donde un fuerte golpe en su cabeza lo mantiene postrado desde esa fecha.A casi 7 años del lamentable episodio, se reveló que el exdeportista estaría siendo tratado en una lujosa mansión, acondicionada como hospital, en Villa Yasmin (Mallorca, España), una propiedad que su esposa Corina compró en 2018 y que pertenecía a Florentino Pérez, actual presidente del Real Madrid.En este recinto, ""Schumi"" seguiría bajo rigurosos resguardos médicos y bajo una condición que no ha sido revelada, pero de la que sí se divulgaron algunos detalles.La mansión donde está SchumacherA esta verdadera mansión, Michael Schumacher habría arribado el año 2018 y se trata de una propiedad ubicada en Puerto de Andrach, Mallorca y que su familia la adquirió a cambio de 35 millones de euros.Se trata de un recinto de 15.000 metros cuadrados, que cuenta con tres casas, está rodeada de extensos jardines y tiene una privilegiada vista al mar.Además, la espectacular villa está formada por dos piscinas, gimnasio y un increíble helipuerto.Este último aspecto podría haber tenido mucho que ver en la compra del inmueble por parte de Corina Schumacher, ya que les alejaría en su totalidad de las miradas indiscretas ante el resguardo total que se mantiene sobre la salud del piloto.No habla y se comunica con sus ojosSobre el estado de salud actual de Schumacher, lamodelo italiana Elisabetta Gregoraci, exesposa de una de las personas más cercanas al alemán, Flavio Briatore, reveló en el reality show Gran Hermano de Italia, que el expiloto de Ferrari ""no habla, sino que se comunica con su familia y los amigos que lo visitan a través de sus ojos"".""Sólo tres personas pueden visitarlo y yo sé quiénes son. Se mudaron a España y su esposa ha montado un hospital en esa casa"", agregó.Según Gregoraci, el movimiento de los ojos de Schumacher es la única señal que permite tener referencia sobre su estado de consciencia y adujo que sus reacciones son muy reducidas.Esta reserva sobre la condición del deportista se debe a una decisión familiar. Incluso, Jean Todt, su ex jefe de equipo en Ferrari, y amigo del germano, sólo ha revelado a lo largo de este 2020, que el otrora corredor de F1 ""está peleando mucho. Michael está luchando. Espero que el mundo pueda volver a verlo pronto. Para esto están trabajando tanto él como su familia”.",['Michael Schumacher']
100,Deportes,De Alexis Sánchez a Víctor Dávila: ¿Cómo llegan las cartas de gol de la Roja a Clasificatorias?,"La Selección Chilena ya comienza a vivir su debut en las Clasificatorias Sudamericanas, ya que el técnico Reinaldo Rueda entregó la nómina con miras para los primeros dos partidos en el camino rumbo al Mundial de Qatar 2022.Así la agenda indica que la Roja saldrá a la cancha el próximo 8 de octubre en su visita a Montevideo para verse las caras ante Uruguay para luego, el 13 del mismo mes recibir aColombia.Y de cara a los exigentes compromisos, el entrenador colombiano ya definió las cartas de gol por las que apostará en el “Equipo de Todos”.Así en la lista aparecen 6 opciones -eran 7, pero se registra una baja- entre las que están los ya goleadores históricos de la Roja como Alexis Sánchez y Eduardo Vargas.Bajo este panorama, revisamos:¿Cómo llegan las cartas de gol de Chile de cara a Clasificatorias?Los delanteros de la RojaAlexis Sánchez: Con 43 goles, el tocopillano es el máximo romperredes histórico de la Selección Chilena y mayor carta de gol. Ahora busca volver a dar que hablar y ya arrancó dando que hablar con la camiseta del Inter de Milán. Tras dos fecha de la Liga Italiana, no registra goles, pero si se ha convertido en un exquisito habilitador.Eduardo Vargas: El segundo máximo goleador histórico de la Roja (38 anotaciones), por estos días, lucha por la titularidad en Tigres de México. Por ahora suma 2 anotaciones, tras 12 fechas jugadas (7 partidos de titular y 678 minutos jugados).Jean Meneses: El apodado ""Takeshi"" da que hablar en elLeón de México, elenco por el que registra en la actual liga azteca cuatro goles tras 13 fechas disputadas (8 juegos de titular y 783 minutos jugados).El último gol lo anotó este viernes 2 de octubre en el triunfo de su elenco por 2-1 ante Mazatlán con un exquisito tiro libre.🇲🇽 Así fue el golazo ⚽️ de tiro libre de Jean Meneses para darle la igualdad parcial a Club León frente a Mazatlán FC. pic.twitter.com/QSI1mXpAUn— Legión Chilena (@LegionChilena) October 3, 2020Víctor Dávila:El ariete nacional, de 22 años, es la principal carta de gol de Pachuca de México y responde a la responsabilidad. Ya lleva cinco goles en el presente torneo (8° anotador de la Liga) y se lució con triplete ante Atlético San Luis. Registra 10 juegos de titular y 811 minutos jugados.🇲🇽 Revisa el golazo ⚽️ de Víctor Dávila para poner en ventaja a Pachuca frente a Mazatlán FC. 📽 @calientesports. pic.twitter.com/kbRw1cSBob— Legión Chilena (@LegionChilena) August 25, 2020Fabián Orellana:Esta convocatoria es la primera para el delantero nacional en un partido oficial desde 2017, hace más de tres años. Su última estadía en la Roja fue el 12 de octubre de 2019 en un amistoso ante Colombia (0-0), donde jugó 59 minutos.Por estos días, es titular indiscutido del Valladolid de España y tras cuatro fecha de La Liga no registra anotaciones.José Pedro Fuenzalida: ""Chapita"" aparece como uno de los delanteros en la lista entregada por el estratego colombiano de cara al debut en Clasificatorias.A sus 35 años, el extremo de Universidad Católica aparece como uno de los fijos de la Roja. El capitán cruzado registra dos goles en el presente Torneo Nacional.FUE LIBERADO DE LA NÓMINAAndrés Vilches:El delantero, de 28 años, y perteneciente a la filas deUnión La Caleraera la gran novedad de la nómina. El ariete fue parte del microciclo realizado por el DT Reinaldo Rueda previo a la convocatoria para Clasificatorias.Sin embargo, en las últimas horas fue liberado de la citación, ya que a través de un parte médico se indicó que el jugador ""debe mantener cuarentena preventiva hasta el miércoles 7 de octubre del 2020"".El atacante registraba una positiva campaña en el cuadro ""cementero"", donde tras 12 fechas disputadas del Torneo Nacional, registraba 4 anotaciones.Ahora se esperará conocer si se abrirá la opción a un nuevo convocado.📍 Información importante | Jugador liberado de la convocatoria de la Selección Chilena🔗 https://t.co/oA15i3AYy2 pic.twitter.com/8KnLp9ifSp— Selección Chilena en 🏡 (@LaRoja) October 2, 2020         View this post on Instagram           🏆⚽️ Esta es la nómina de la Selección Chilena (@laroja) con miras a los cotejos ante Uruguay (@aufoficial) y Colombia (@fcfseleccioncol) en el camino al Mundial de Qatar. 🔴➡️Arqueros Gabriel Arias (Racing, Argentina) Brayan Cortés (Colo Colo) Omar Carabalí (San Luis) 🔴➡️ Defensas Mauricio Isla (Flamengo, Brasil) Gary Medel (Bologna, Italia) (Lesionado)  Sebastián Vegas (Monterrey, México) Paulo Díaz (River Plate, Argentina) Nicolás Díaz (Mazatlán, México) Enzo Roco (Fatih Karagümrük, Turquía) Francisco Sierralta (Watford, Inglaterra) Guillermo Soto (Palestino) Rodrigo Echeverría (Everton) (Llamado de emergencia)  🔴➡️ Mediocampistas Tomás Alarcón (O'Higgins) Charles Aránguiz (Bayer Leverkusen, Alemania) Arturo Vidal (Inter de Milán, Italia) Lorenzo Reyes (Atlas, México) Claudio Baeza (Necaxa, México) César Pinares (Universidad Católica) Diego Valdés (Santos Laguna, México) Rodrigo Gaete (Cobresal) (Llamado de emergencia) 🔴➡️ Delanteros Alexis Sánchez (Inter de Milán, Italia) Eduardo Vargas (Tigres, México) José Pedro Fuenzalida (Universidad Católica) Víctor Dávila (Pachuca, México) Andrés Vilches (Unión La Calera) (Desconvocado)  Jean Meneses (León, México) Fabián Orellana (Valladolid, España) (Desconvocado) A post shared by  Mega Deportes CL (@megadeportescl) on Oct 1, 2020 at 10:29am PDT","['Selección Chilena', 'Clasificatorias Sudamericanas']"
101,Deportes,Liberan a Andrés Vilches de la Selección: Deberá mantener cuarentena preventiva,"La Gerencia de Comunicaciones de la Federacion de Fútbol de Chile, comunicó este viernes que Andrés Vilches fue liberado de la nómina de la Selección Chilena para los próximos partidos clasificatorios ante Uruguay y Colombia rumbo a Qatar 2022.Razones médicasEl actual delantero de Unión La Calera fue descartado por un posible contagio de coronavirus, por lo que según lo dispuesto porla autoridad sanitaria, ""debe mantener cuarentena preventiva hasta el miércoles 7 de octubre del 2020"".Por el momento se desconoce quién será el reemplazante del exjugador de Colo Colo, UC y Huachipato para los encuentros contra charrúas y cafeteros que se disputarán el 8 y 13 de octubre, respectivamente.📍 Información importante | Jugador liberado de la convocatoria de la Selección Chilena🔗 https://t.co/oA15i3AYy2 pic.twitter.com/8KnLp9ifSp— Selección Chilena en 🏡 (@LaRoja) October 2, 2020¿Quiénes componen la nómina?En la convocatoria destacan jugadores históricos de La Roja,liderados porArturo Vidal(Inter de Milán) yAlexis Sánchez(Inter de Milán).También aparecen figuras como Mauricio Isla (Flamengo), Gary Medel (Bologna), Charles Aránguiz (Bayer Leverkusen) y Eduardo Vargas (Tigres).Eso sí, algunas de las grandes novedades en la citación son el joven volante de O'Higgins, Tomás Alarcón (21 años), el defensor Guillermo Soto (Palestino) y el portero Omar Carabalí (San Luis).🇨🇱⚽ Recuerda la nómina de #LaRoja, para los duelos por Eliminatorias ante Uruguay y Colombia.🔗 https://t.co/h0948DFCNS #Chile #SelecciónChilena #Nómina #Qatar2022 pic.twitter.com/h60jKKSuUe— Selección Chilena en 🏡 (@LaRoja) October 1, 2020","['Selección Chilena', 'Qatar 2022']"
102,Deportes,Vidal y Sánchez lideran nómina de la Selección Chilena: Jugador de La Calera es la gran novedad,"La Selección Chilena se prepara para volver a tener acción de cara al arranque de las Clasificatorias Sudamericanas rumbo al Mundial de Qatar 2022.Esto porque el técnico Reinaldo Rueda entregó su primera nómina del año 2020 para afrontar sus primeros desafíos pactados para octubre, donde la Roja se verá las caras ante Uruguay (8 de octubre en Montevideo) y Colombia (13 de octubre en Santiago).La lista está conformada por 25 jugadores nacionales y extranjeros que comenzarán con el sueño mundialista.Arturo Vidal y Alexis Sánchez lideran la nóminaLa lista está conformada por jugadores históricos de la escuadra nacional liderados por Arturo Vidal (Inter de Milán) y Alexis Sánchez (Inter de Milán), quenes son la base del ""Equipo de Todos"".Eso sí, lamenta las bajas de nombres claves como Claudio Bravo (Betis, España) que está lesionado y Erick Pulgar (Fiorentina, Italia) que se recupera tras padecer Covid-19.Las grandes novedades en la citación son el goleador de Unión La Calera, Andrés Vilches, el joven volante de O'Higgins, Tomás Alarcón (21 años), el defensor Guillermo Soto (Palestino), además, del portero Omar Carabalí (San Luis).Así la Roja se prepara para volver a competir, siendo el último partido que registró el pasado 15 de octubre del 2019, cuando los dirigidos de Reinaldo Rueda se impusieron por 3-2 a Guinea.¡Hay nómina para iniciar la ruta hacia la @fifaworldcup!🇨🇱😍 El técnico de #LaRoja, Reinaldo Rueda, citó a 25 futbolistas para los duelos ante Uruguay y Colombia, correspondientes a la primera y segunda jornada, respectivamente, de las Clasificatorias #Qatar2022. pic.twitter.com/t78pSrf7Xk— Selección Chilena en 🏡 (@LaRoja) October 1, 2020Nómina de la Selección ChilenaArquerosGabriel Arias (Racing, Argentina)Brayan Cortés (Colo Colo)Omar Carabalí (San Luis)DefensasMauricio Isla (Flamengo, Brasil)Gary Medel (Bologna, Italia)Sebastián Vegas (Monterrey, México)Paulo Díaz (River Plate, Argentina)Nicolás Díaz (Mazatlán, México)Enzo Roco (Fatih Karagümrük, Turquía)Francisco Sierralta (Watford, Inglaterra)Guillermo Soto (Palestino)MediocampistasTomás Alarcón (O'Higgins)Charles Aránguiz (Bayer Leverkusen, Alemania)Arturo Vidal (Inter de Milán, Italia)Lorenzo Reyes (Atlas, México)Claudio Baeza (Necaxa, México)César Pinares (Universidad Católica)Diego Valdés (Santos Laguna, México)DelanterosAlexis Sánchez (Inter de Milán, Italia)Eduardo Vargas (Tigres, México)José Pedro Fuenzalida(Universidad Católica)Víctor Dávila (Pachuca, México)Andrés Vilches (Unión La Calera)Jean Meneses (León, México)Fabián Orellana (Valladolid, España)","['Selección Chilena', 'Clasificatorias Sudamericanas']"
103,Deportes,Garin logra histórica clasificación a tercera ronda de Roland Garros,"Cristian Garin, 19 de la ATP, avanzó en Roland Garros luego de imponerse en más de tres horas de partido al australiano Marc Polmans (122°).Con este triunfo el nacional clasificó por primera vez en la tercera ronda de un Grand Slam, donde enfrentará al ruso Karen Khachanov (16°), que hoy venció 6-1, 6-7, 7-6 y 7-6 al checo Jiri Vesely (68°).Remontó para ganarLa primera raqueta nacional superó un irregular comienzo para finalmente llevarse el encuentro en cuatro sets, por parciales de 6-7 (5), 6-2, 7-6(3) y 6-4.En la primera manga, ambos tenistas cedieron sus servicios en dos oportunidades, lo que llevó todo al tie break, donde el oceánico se mostró más certero.No obstante, en el segundo capítulo, Garin se sobrepuso a un temprano quiebre para luego quedarse en tres oportunidades con el servicio de Polmans y cerrar la tarea en 40 minutos.Las cosas volvieron a emparejarse en el tercer set, donde cada uno consiguió un rompimiento de servicio que llevó todo a un nuevo tie break, en donde el chileno se mostró más sólido.Finalmente, el “Tanque” mantuvo su nivel en la cuarta manga, quebrando el saque del australiano en una oportunidad para cerrar el encuentro con un parcial de 6-4.         View this post on Instagram           🔴🎾 El tenista nacional (19°) se impuso por 6-7, 6-2, 7-6 y 6-4 al australiano Marc Polmans (122°) y sigue escalando en el Grand Slam de @rolandgarros. ➡️ Ahora se medirá ante el ruso Karen Khachanov, actual 16 del mundo. No registran enfrentamientos previos. A post shared by  Mega Deportes CL (@megadeportescl) on Oct 1, 2020 at 6:01am PDT","['Roland Garros', 'Cristian Garin']"
104,Deportes,Colo Colo y Católica caen y complican sus opciones en Copa Libertadores 2020,"Este martes fue una jornada negra para los equipos chilenos en Copa Libertadores 2020, pues Colo Colo y Universidad Católica fueron derrotados por sus respectivos rivales.A pesar de la caída 3 a 0 frente a Peñarol en Uruguay, los albos quedan con algunas chances de seguir avanzando en el torneo continental, a la espera del resultado entre Athletico Paranaense y Jorge Wilstermann.Por su parte, los cruzados fueron derrotados 2 a 0 por Gremio en Porto Alegre, quedando en el último puesto de su grupo y al borde de ser eliminados de la competencia internacional.Próximos partidosEl martes 20 de octubre Colo Colo tendrá un partido crucial para sus aspiraciones, pues recibirá a Wilstermann en un duelo clave para seguir avanzando en la Libertadores.En tanto, los de la franja se medirán como locales ante Internacional de Porto Alegre, desafío pactado para el próximo jueves 22 de octubre, donde solo un milagro los instalaría en la siguiente fase.","['Colo Colo', 'Universidad Católica fútbol']"
105,Deportes,Peñarol denuncia que Colo Colo rompió burbuja sanitaria de Copa Libertadores,"Colo Colo nuevamente está en la mira, ya que la prensa de Uruguay reveló que el club albo incumplió el protocolo sanitario establecido por Conmebol para los duelos por Copa Libertadores, en la antesala del partido de esta tarde (19:15 horas) con Peñarol.Fue en palabras del periodista Hernán Braga de la Radio 1010 AM, quien denunció en sus redes sociales que jugadores del Cacique recibieron la visita de Gustavo Bizcayzacú, exjugador charrúa que militó en el cuadro nacional, lo que contraviene las medidas del torneo internacional ante la pandemia de coronavirus.🚨 #ATENCIÓN | #ColoColo rival de #Peñarol hoy en el marco de la #CopaLibertadores, rompió la burbuja sanitaria. La CONMEBOL prohibe visitas y Gustavo Biscayzacú subió a sus redes sociales una foto con Esteban Paredes, en el hotel de Montevideo donde se está alojando el “Cacique” pic.twitter.com/eY8jNIdmK2— Hernán Braga (@hernanbraga1) September 29, 2020En su plan sanitario, la Conmebol recomienda evitar “desplazamientos innecesarios por el hotel y lugares donde podría haber aglomeraciones, al igual que mantener contacto con personas extrañas a la delegación”.Sin embargo, Biscayzacú subió a su cuenta de Instagram una fotografía, donde aparece junto a Esteban Paredes, quien le entrega una camiseta del equipo al uruguayo.         View this post on Instagram           ¡Respetando el protocolo, fue un placer volver a ver a dos grandes amigos que me dio el fútbol, Victor González a quien le agradezco este hermoso obsequio, y al gran  goleador @e.paredes7 ! . ¡Mucha suerte mañana @colocolooficial ! 💪🏼⚽️ A post shared by  Gustavo Biscayzacu (@gustavobiscayzacu) on Sep 28, 2020 at 7:18pm PDTPeñarol presentó queja formalAnte la situación, el delegado de Peñarol ante la Asociación Uruguaya de Fútbol (AUF), Juan Antonio Rodríguez, señaló al programa “La Oral Deportiva” de Radio Universal, que presentaron un reclamo ante la entidad charrúa y la Comisión de Seguridad de la Conmebol.El dirigente afirmó que “la AUF y Comisión de Seguridad tomaron medidas porque se rompió la burbuja sanitaria de Colo Colo. Hay sanciones previstas desde multas a pérdidas de puntos, pero considero que el partido no corre riesgo"".#AHORA Habla Juan Antonio Rodríguez, delegado de @OficialCAP señala que ""la AUF y Comisión de Seguridad tomaron medidas porque se rompió la burbuja sanitaria de Colo Colo. Hay sanciones previstas desde multas a pérdidas de puntos pero considero que el partido no corre riesgo"".— La Oral Deportiva (@laoraldeportiva) September 29, 2020La situación pone en entredicho a un Colo Colo que ya enfrenta un complejo escenario por la suspensión del partido con Deportes Antofagasta el pasado sábado, donde arriesgan perder los tres puntos, según indicó el presidente de la ANFP, Pablo Milad.         View this post on Instagram           ⚽️➡️🏆 @colocolooficial  y @cruzados_oficial salen esta tarde del martes 29 de septiembre a la cancha y esto indica la agenda: 🔴 Peñarol vs. Colo Colo Estadio Campeón del Siglo 19:15 horas de Chile. Transmisión: Fox Sports Premium, Facebook Watch, además de la app de pago Fox Play. 🔴 Gremio vs. Universidad Católica EStadio Arena Do Gremio 19:15 horas de Chile Transmisión: Fox Sports. A post shared by  Mega Deportes CL (@megadeportescl) on Sep 29, 2020 at 8:35am PDT","['Colo Colo', 'Copa Libertadores']"
106,Deportes,La U tropieza con Unión Española y se aleja del puntero: Revisa la tabla de posiciones,"Universidad de Chile cayó como visita por 3-1 frente aUnión Española, en un partido válido por la Fecha 12 del Torneo Nacional.El partidoEl cotejo lo comenzó ganando el cuadro azul con un tanto del goleador del certamen, Joaquín Larrivey (22'),quien descolocó al arquero Diego Sánchez con un violento disparo.El empate llegó desde los pies de Cristian Palacios (48') segundos antes de que finalizara la primera fracción.Ya en el complemento, Mario Sandoval (55') puso en ventaja al cuadro de colonia con un tiro libre que no pudo contener el portero Fernando de Paul.Cristian Palacios (81') fue el encargado de ampliar el marcador, tras anotar su doblete personal.El próximo partido de la U será frente a Universidad Católica en una nueva versión del Clásico Universitario, el domingo 4 de octubre,mientras que Unión Española se medirá frente a La Serena el próximo sábado.Así está la tabla de posiciones","['Universidad de Chile fútbol', 'Unión Española']"
107,Deportes,"""Determinante"": Prensa italiana alaba a Alexis Sánchez tras triunfo del Inter","La prensa italiana llenó de elogios al seleccionado nacional, Alexis Sánchez, luego de haber sido protagonista en la victoria por 4 a 3 del Inter de Milán sobre la Fiorentina.""Determinante""La Gazzeta dello Sport alabó al tocopillano e incluso lo catalogó como ""determinante"" luego de aportar con una asistencia en la goleada de su equipo.A pesar de haber jugado los últimos minutos del encuentro, el delantero chileno se ganó la mejor nota de su escuadra: un 7.""Después de tantos cambios, Alexis en tres cuartos de cancha pidió la pelota y la puso en el pie de Hakimi y en la cabeza de D’Ambrorio"", se detalló.Los elogios para VidalOtro que no se quedó atrás fue Arturo Vidal, quien hizo su debut con los lombardos y que, al igual que Sánchez, ingresó en los minutos finales.""Participó en la remontada más con el espíritu que con la sustancia"", comentó la prensa.FOTO: REUTERSPor otra parte, en su cuenta oficial de Instagram, el Inter de Milán catalogó a ambos chilenos como ""guerreros"".👊 | GUERRIERI""Ragazzi, serve una mano?"" 🇨🇱 Arturo #Vidal🇨🇱 Alexis #Sanchez#InterFiorentina ⚫️🔵 #FORZAINTER pic.twitter.com/woIKQKb8jH— Inter (@Inter) September 26, 2020","['Alexis Sánchez', 'Arturo Vidal']"
