,categoria,titulo,contenido,tags
197,Mundo,"Canciller alemana pide a los ciudadanos de su país ""coraje"" frente a la pandemia de coronavirus","La canciller alemana, Angela Merkel, pidió a los ciudadanos de su país que demuestren el mismo ""valor"" ante la pandemia de coronavirus que cuando cayó el régimen de Alemania del este, en el marco del 30º aniversario de la reunificación nacional.""Revolución pacífica""""Sabemos que hoy debemos tener el coraje de emprender nuevos caminos debido a la pandemia"" de covid-19, afirmó la dirigente conservadora en Postdam, al suroeste de Berlín, donde tienen lugar las ceremonias.""Se necesitó mucho coraje (...) para las personas en la antigua Alemania del este que salieron a la calle, que iniciaron la revolución pacífica"" en el otoño boreal de 1989, añadió en una breve intervención.Antes, la canciller y el presidente del Bundestag (Cámara de Diputados), Wolfgang Schäuble, participaron en un servicio ecuménico en la Iglesia de San Pedro y Pablo de Potsdam.Solo 130 personas fueron autorizadas a entrar en el recinto religioso para respetar las medidas de distanciamiento social impuestas por la pandemia.Menos de un año después de la caída del Muro de Berlín, el 9 de noviembre de 1989, Alemania recuperó su unidad nacional.Desde entonces, la fiesta nacional alemana se celebra el 3 de octubre.",['Coronavirus']
198,Mundo,Hombre se tragó por accidente un cepillo de dientes y debió ser operado de urgencia,"Un hombre se tragó por accidente un cepillo de dientes en la India y debió ser operado de urgencia tras presentar molestias en su cuerpo.¿Cómo ocurrió el hecho?El hecho ocurrió mientras el afectado se encontraba utilizando el artefacto, lo que produjo que contactara a un otorrinolaringólogo que lo examinó en una primera instancia, según informó el medio Caracol.Sin embargo, el médico no pudo ubicar dónde se encontraba el objeto, por lo que el hombre tuvo que acudir a un cirujano.Bomni Tayeng fue la persona quien posteriormente lo trató y afirmó que ""fue complicado rastrear el cepillo"".La cirugíaMinutos más tarde, el paciente fue derivado alHospital Memorial Kain Pertin, donde finalmente fue intervenido por personal médico.""El paciente debió estar limpiando la pared bucal alrededor de las caries dentales cuando se tragó por error el cepillo de dientes"", fue la explicación que dio Tayeng.Además, aclaró que la víctima no presentó dolor al ingerir el objeto y solo evidenció molestias en la zona del abdomen.",[]
199,Mundo,Trump recibe mensajes de apoyo de todo el mundo tras contraer coronavirus,"El Presidente de Estados Unidos, Donald Trump, recibió varios mensajes de apoyo en las últimas horas tras contraer coronavirus junto a su esposa, Melania Trump.De Corea del Norte hasta Brasil, pasando por los principales países europeos, los dirigentes mundiales, adeptos o detractores de las políticas del mandatario, le han deseado que se restablezca totalmente y cuanto antes.El mensaje de Joe BidenTambién su principal adversario en este momento, el candidato demócrata a la Casa Blanca, Joe Biden, le deseó una ""pronta recuperación"" y dijo que él y su esposa rezan para que sane, pero también le pidió no hacerse el ""duro"" con la pandemia y ""usar mascarilla"".¿Qué dijo Obama?Barack Obama, predecesor de Trump en la Casa Blanca, transmitió sus ""mejores deseos"" al jefe de Estado y a todos los enfermos de Covid-19 en ese país.""Estamos en medio de una batalla política en este momento (...) pero recordemos que todos somos americanos y seres humanos y queremos que todo el mundo sane, independientemente de su partido político"", dijo, refiriéndose a las elecciones presidenciales del 3 de noviembre.FOTO: AFPMensajes de otros políticosVladimir Putin no se quedó atrás y también se refirió a la situación, sosteniendo que ""estoy convencido de que su vitalidad natural, su fortaleza de espíritu y su optimismo le ayudarán a vencer a este peligroso virus"".Por otra parte, el líder norcoreano, Kim Jong Un, dijo que espera sinceramente que Trump y Melania ""se recuperen lo antes posible. Espero que lo superen. Les envió un cordial saludo"".El Presidente de Brasil, Jair Bolsonaro, expresó que ""con fe en Dios, pronto estarán recuperados y su conducción del país y su campaña de reelección no serán perjudicados"".También el propiodirector general de la Organización Mundial de la Salud (OMS), TedrosAdhanom Ghebreyesus, deseó ""una pronta y completa recuperación"" al mandatario y su esposa.Otros presidentes que también enviaron mensajes de apoyo a Trump fueron los de México (Andrés Manuel López Obrador), Colombia (Iván Duque), Guatemala (AlejandroGiammattei) y El Salvador (Nayib Bukele).","['Donald Trump', 'Coronavirus']"
200,Mundo,Video muestra a mujer bailando y celebrando tras encontrar trabajo,"Con baile, alegría y mucho carisma, Kayallah Jones celebró que fue aceptada en un empleo, tras una entrevista de trabajo que tuvo el pasado 29 de septiembre en Atlanta, Estados Unidos.Luego de ser aceptada, la mujer salió del recinto, dio unos pasos, luego se detuvo y, al ver que no había nadie a su alrededor, celebró efusivamente bailando en pleno estacionamiento.Lo que Kayallah no sabía era que Dakara Spence, quien será su nueva jefa y quien le hizo la entrevista, estaba viendo todo a través de la cámara de seguridad de la empresa. ""Acabo de contratar a esta joven y esta fue su respuesta"", indicó Spence en Instagram, donde logró más de 800 mil reproducciones.         View this post on Instagram           ¡TREMENDA REACCIÓN! 💃  #KayallahJones se hizo #viral con su #celebración 👏👏 Tan contenta estaba de conseguir un contrato en tiempos de pandemia que no se resistió a bailar en los estacionamientos de su nuevo empleo en #Atlanta, EE.UU. Las cámaras captaron el notable momento 🙌 A post shared by  Meganoticias (@meganoticiascl) on Oct 2, 2020 at 1:01pm PDTLa respuesta de Kayallah""Cuando salí, no sabía que las cámaras me habían captado"", dijo la nueva trabajadora al medio norteamericano CBS, asegurando además que durante la pandemia perdió varios trabajos.""Dakara no lo sabía, pero estaba pasando por muchas cosas y en ese momento me dio esta oportunidad. Estaba eufórica, emocionada y tan abrumada hasta el punto en que nadie entendía lo feliz y realizada que me sentía en ese momento"", explicó.Una de las razones por las que la mujer fue contratada fue porque “tenía una gran energía. Lo sentí tan pronto como entró, parecía realmente positiva"", culminó la jefa.",['Estados Unidos']
201,Mundo,"Trump por su hospitalización debido al coronavirus: ""Vamos a asegurarnos de que todo salga bien""","Durante la tarde de este viernes, el Presidente de Estados Unidos, Donald Trump, fuehospitalizadocomo medida de precaución luego de dar positivo por coronavirus, y fue el propio mandatario el que aclaró que el objetivo es chequear que todo esté bien con su salud.¿Qué dijo Trump?""Quiero agradecer a todos por el apoyo. Ahora voy al hospital. Me siento muy bien y vamos a asegurarnos de que todo salga bien. La primera dama también está muy bien. Los aprecio y no lo olvidaré. Muchas gracias"", aseguró Trump en su cuenta de Twitter.pic.twitter.com/B4H105KVSs— Donald J. Trump (@realDonaldTrump) October 2, 2020Trump permanecerá en el Centro Médico Militar Nacional Walter Reed, tras ser trasladado hasta el recinto en helicóptero.La recomendaciónLa decisión fue adoptada luego de la recomendacipon del médico de Trump, según informó la secretaria de prensa Kayleigh McEnany.El mandatario estadounidense se mantendrá en el recinto hospitalario para ser monitoreado durante varios días, aunque se mantendrá trabajando en el lugar.¿Presenta síntomas?Tres personas cercanas al Presidente informaron que Trump presenta fiebre baja, mientras que ya le fue administardo uncóctel de anticuerpos y vitaminas.Además se informó que por ahora sólo se ha sentido fatigado, sin presentar síntomas graves.En tanto, su esposa Melania Trump ha presentado una tos leve y dolor de cabeza.Descartan contagio de BidenEl candidato demócrata Joe Biden poco antes que dio negativo en la prueba de covid-19, tres días después del debate presidencial con Trump, su rival en las elecciones del 3 de noviembre.""Me complace informar que Jill y yo hemos dado negativo en las pruebas de covid"", anunció Biden, sobre el resultado para él y su esposa. ""Espero que esto sirva como recordatorio: usen una máscara, mantengan la distancia social y lávense las manos"", afirmó.","['Donald Trump', 'Coronavirus']"
202,Mundo,"Madrid anuncia cierre de la ciudad: ""Estamos ante un momento de extraordinaria gravedad""","Madrid y otras nueve localidades de la capital serán cerradas, como parte de las medidas sanitarias implementadas por el ministerio de salud, ante la segunda ola de contagios por coronavirus.El cierre comenzará este mismo viernes a las 22 horas y tras la decisión el mandatario del país europeo, Pedro Sánchez, ha pedido disculpas a la comunidad por ""el desasosiego y la incertidumbre que se está generando por la decisión del Gobierno de la nación"".“No hablamos de confinar, hablamos de limitar movimientos. La situación en Madrid es crítica porque concentra el 33% de los fallecidos. Estamos ante un momento de extraordinaria gravedad en la Comunidad de Madrid, sin duda sí. Estamos hablando de salvar vidas, de defender la salud pública. El debate es absolutamente otro. La gravedad es la que es y el Gobierno de España respetando el ámbito competencial, plantea las medidas"", dijo Sánchez al anunciar que las medidas iniciarán este viernes 2 de octubre.A través del Boletín Oficial de la Comunidad de Madrid será confirmada la decisión que dejará confinados Madrid y los municipios de Alcalá de Henares, Alcobendas, Alcorcón, Fuenlabrada, Getafe, Leganés, Móstoles, Parla y Torrejón de Ardoz. Esto afectará a 4.786.948 habitantes aproximadamente.¿Cuáles son las restricciones para las localidades cerradas?Se restringirá la entrada y salida de los municipios afectados, salvo que los desplazamientos sean justificados: asistencia a centros sanitarios, cumplimiento de obligaciones laborales u otras causas de fuerza mayor.Las reuniones, tanto en espacios públicos como privados, se reducirán a seis personas, salvo que sean convivientes o que se trate de una actividad laboral o institucional.El aforo en los lugares de culto tendrá que ser de un tercio, siempre que se garantice la distancia mínima interpersonal de 1,5 metros.A los velatorios solo podrán acudir 15 personas si es un espacio al aire libre o diez, en un espacio cerrado, sean o no convivientes.El aforo en los locales comerciales se reducirá al 50% y la hora de cierre no podrá superar las 22:00 horas.El aforo en los establecimientos de hostelería y restauración y de juegos y apuestas se verá reducido a un 50% en espacios interiores y a un 65% en espacios exteriores. El consumo en barra no estará permitido.El cierre deberá ser antes de las 23:00 horas, a menos que sea reparto a domicilio.Academias, autoescuelas y centros de enseñanzas no regladas también deberán reducir su aforo al 50%.En instalaciones deportivas, tanto al aire como interior, el aforo será del 50% si es un espacio cerrado y del 65% si es un espacio abierto. Además, la práctica en grupos se reducirá a un máximo de seis personas.Parques infantiles permanecerán abiertos, pero se deberán mantener las medidas de distanciamiento social y uso obligatorio de mascarilla.","['España', 'Coronavirus']"
203,Mundo,Trump podría verse obligado a ceder temporalmente el poder,"El presidente de Estados Unidos, Donald Trump, podría verse obligado a ceder temporalmente el poder al vicepresidente si se encuentra incapacitado, una posibilidad a la que acudieron dos presidentes y que está contemplada en la 25º enmienda de la Constitución.Esta enmienda fue adoptada en 1967 y detalla la transferencia de poderes si un presidente muere, renuncia, si es destituido o si está impedido de ejercer sus funciones.Trump, de 74 años y quien tiene sobrepeso, anunció en la madrugada del viernes que él y la primera dama, Melania, de 50, dieron positivo para la covid-19, una enfermedad que deja más de 200 mil muertos en Estados Unidos. El líder informó que ambos van a estar en cuarentena.El jefe de gabinete, Mark Meadows, dijo a los periodistas que el presidente tiene ""síntomas leves"" y está de ""buen humor"".La noticia irrumpió en la campaña electoral a casi un mes de las elecciones del 3 de noviembre y genera incertidumbre sobre una posible transferencia de poderes al vicepresidente, Mike Pence, si Trump empeora.Los legisladores comenzaron a analizar este escenario a finales de la década de 1950, en respuesta a los problemas de salud que sufrió el presidente Dwight D. Eisenhower.Con el asesinato de John F.Kennedy en 1963 la cuestión adquirió urgencia y una enmienda fue aprobada por el Congreso en 1965 y ratificada dos años más tarde por tres cuartos de los estados, como era requerido.El apartado 3 de la enmienda dirime la transferencia de los poderes presidenciales al vicepresidente cuando el jefe del Ejecutivo declare que está incapacitado para cumplir con sus funciones o con sus obligaciones.En la siguiente sección, el apartado 4, se aborda un escenario en el que el vicepresidente y una mayoría del gabinete determinen que el mandatario esté imposibilitado y lo releven de sus funciones. Este capítulo nunca ha sido invocado.Invocado en tres ocasionesLa sección 3 ha sido invocada en tres ocasiones. La primera vez en julio de 1985 cuando el presidente republicano Ronald Reagan fue sometido a anestesia general durante una operación en la que le extirparon un pólipo canceroso de su intestino grueso.El vicepresidente George H.W. Bush estuvo como presidente interino durante ocho horas mientras duraba el procedimiento.En junio de 2002 y en julio de 2007 cuando George W. Bush era presidente, su segundo al mando, Dick Cheney, también tuvo el poder temporalmente mientras el mandatario era sometido a colonoscopías de rutina bajo anestesia.El apartado tercero indica que el mandatario debe informar por escrito al presidente pro témpore, del Senado, actualmente Chuck Grassley, y al líder de la Cámara de Representante, que ahora es Nancy Pelosi, que no puede cumplir con los deberes de su mandato y que va a transferir temporalmente los poderes al vicepresidente.Según el capítulo 4, el vicepresidente y la mayoría de los miembros de su gabinete proceden a informar a los líderes del Congreso que el presidente es incapaz de ejercer sus funciones y que el vicepresidente ocupará su lugar.Si el presidente cuestiona esta afirmación, corresponde al Congreso tomar una decisión. Entonces, para declararlo no apto es necesaria una mayoría de dos tercios en la Cámara Baja y en el Senado.John Hudak, un alto cargo de Brookings Institution, con sede en Washington, publicó un video explicando que Trump podría invocar la sección 3 si cae ""muy enfermo"" o necesita ser colocado en ventilación mecánica.""Si el presidente se da cuenta de que su estado empeora y es incapaz de llevar a cabo las funciones de su mandato puede invocar la sección 3"", indicó Hudak.","['Donald Trump', 'Coronavirus']"
204,Mundo,Donald Trump debe ser hospitalizado a causa del coronavirus,"Durante la tarde de este viernes, la Casa Blanca informó que el Presidente de Estados Unidos, Donald Trump, se mantendrá hospitalizado por los próximos días como medida de precaución luego de dar positivo por coronavirus.#ÚLTIMAHORA Trump va a estar hospitalizado por los ""próximos días"", dice portavoz de la Casa Blanca #AFP pic.twitter.com/IGyRBgZ6JY— Agence France-Presse (@AFPespanol) October 2, 2020Trump permanecerá en el Centro Médico Militar Nacional Walter Reed, tras ser trasladado hasta el recinto en helicóptero, informó el medio local NBC.La recomendaciónLa decisión fue adoptada luego de la recomendacipon del médico de Trump, según informó la secretaria de prensa Kayleigh McEnany.El mandatario estadounidense se mantendrá en el recinto hospitalario para ser monitoreado durante varios días, aunque se mantendrá trabajando en el lugar.¿Presenta síntomas?Según el medio antes mencionado, tres personas cercanas al Presidente informaron que Trump presenta fiebre baja, mientras que ya le fue administardo uncóctel de anticuerpos y vitaminas.Además se informó que por ahora sólo se ha sentido fatigado, sin presentar síntomas graves.En tanto, su esposa Melania Trump ha presentado una tos leve y dolor de cabeza.Descartan contagio de BidenEl candidato demócrata Joe Biden poco antes que dio negativo en la prueba de covid-19, tres días después del debate presidencial con Trump, su rival en las elecciones del 3 de noviembre.""Me complace informar que Jill y yo hemos dado negativo en las pruebas de covid"", anunció Biden, sobre el resultado para él y su esposa. ""Espero que esto sirva como recordatorio: usen una máscara, mantengan la distancia social y lávense las manos"", afirmó.","['Donald Trump', 'Coronavirus']"
205,Mundo,Niña de 12 años muere infestada de piojos: Sus padres podrían ir a la cárcel,"Una niña de 12 años de edad falleció en Georgia, Estados Unidos, a causa de un ataque cardíaco provocado por anemia. Las investigaciones revelan que este escenario pudo haberse dado porque la menor estuvo infestada de piojos durante tres años aproximadamente.Se presume que la prolongación de la enfermedad pudo haber detonado la anemia de la niña y su posterior deceso. Un escenario terrible, en el que las autoridades responsabilizan a los padres por “descuido”.Mary Katherine Horton, de 37 años, y Joey Yozviak, de 38, son los padres de Kaitlyn Yozviak, la niña fallecida. Ambos enfrentan actualmente un juicio por haber “descuidado” a su hija, situación que podría llevarlos a prisión por varios años, a pesar de testificar en un tribunal sobre el desconocimiento de los malestares de la menor de acuerdo a lo que consignó Televisa en su portal web.Durante la investigación del caso, las autoridades fueron a la casa de la familia destacando que allí encontraron gatos, heces, piojos y otros animales, por lo que la negligencia de los padres resultó evidente para Ryan Hilton, el investigador formal del caso.STORY: Kaitlyn Yozviak was once featured in our My Teacher is Tops series for nominating her teacher, Ms. Courtney Amerson. This week, she was found dead and her mother was charged with her murder. Here’s how teachers remembered her. This was tough.Link: https://t.co/RmC8iZK830 pic.twitter.com/9kfefYdPl7— Kayla Solomon (@KSolomonReports) August 29, 2020Antecedentes familiaresLos exámenes post mortem de Kaitlyn arrojaron bajos niveles de hierro en su cuerpo y una gran cantidad de picaduras de insectos en su cabeza. Además, la menor sufría de una desnutrición severa desde hace años.Como parte de la investigación, también se pudo evidenciar que Mary y Joey intentaron darla en adopción hace varios años, sin resultados “positivos”.Además de Kaitlyn, la pareja tiene otros dos hijos varones, quienes fueron retirados del hogar por las autoridades, para evitar una tragedia similar por las condiciones insalubres de la vivienda.Hasta ahora, los padres no están bajo arresto, sin embargo han sido culpados de asesinato y enfrentarán un duro juicio para determinar la pena que cumplirán por no cuidar a su hija.",['Estados Unidos']
206,Mundo,Joe Biden da negativo al coronavirus tres días después del debate con Trump,"El candidato demócrata a la Casa Blanca, Joe Biden, anunció el viernes que dio negativo en la prueba de covid-19, tres días después del debate con el presidente Donald Trump, su rival en las elecciones del 3 de noviembre, quien contrajo la enfermedad.¿Qué dijo?""Me complace informar que Jill y yo hemos dado negativo en las pruebas de covid"", anunció Biden, sobre el resultado para él y su esposa. ""Espero que esto sirva como recordatorio: usen una máscara, mantengan la distancia social y lávense las manos"", añadió.Minutos antes, su médico, Kevin O'Connor, dijo que el exvicepresidente y su esposa se habían sometido el viernes a pruebas de PCR para covid-19 ""y no se detectó covid-19"".I’m happy to report that Jill and I have tested negative for COVID. Thank you to everyone for your messages of concern. I hope this serves as a reminder: wear a mask, keep social distance, and wash your hands.— Joe Biden (@JoeBiden) October 2, 2020Mantiene su agendaDescartado el contagio el candidato demócrata a la Casa Blanca anunció también que mantendrá su agenda, la que tiene contemplada ahora un viaje a Michigan.El exvicepresidente de Barack Obama, de 77 años, tiene previsto visitar Grand Rapids, una ciudad en este estado del Medio Oeste del país donde ganó Trump en 2016.","['Donald Trump', 'Elecciones EEUU 2020']"
207,Mundo,Vómitos y aversión a la luz: Los síntomas de mujer que perdió líquido cerebral tras test PCR,"Vómitos y aversión a la luz, fueron algunos de los síntomas que sufrióuna mujer estadounidense que, tras someterse al examen de PCR que detecta el coronavirus,sufrió una fuga de líquido cerebral,situación que la expuso a un riesgo ""potencialmente mortal"", según un estudio.Jarrett Walsh, autor principal del artículo que apareció en JAMA Otolaryngology-Head &amp; Neck Surgery, señaló que “el caso mostró que los profesionales de la salud deben tener cuidado en seguir al pie de la letra los protocolos de la prueba”.Agregó que “las personas que se han sometido a una cirugía nasal o de la base del cráneo deberían considerar una prueba oral, en caso de estar disponible”.“La paciente, de unos 40 años, tenía una condición poco común no diagnosticada y la prueba que recibió pudo haberse realizado de manera incorrecta, una secuencia de eventos inusuales que significa que el riesgo de las pruebas nasales sigue siendo muy bajo"", indicó Walsh.Los síntomasUna prueba nasal para detectar covid-19 perforó el revestimiento del cerebro de la mujer estadounidense provocando que se filtrara líquido por la nariz y la pusiera en riesgo de una infección potencialmente mortal, informaron médicos en una revista médica el jueves.Walsh dijo que la mujer se había sometido a una prueba nasal antes de una cirugía de hernia y que notó que un líquido transparente salía de un lado de la nariz.Posteriormente desarrolló dolor de cabeza, vómitos, rigidez en el cuello y aversión a la luz. Entonces fue transferida para que Walsh la atendiera.Condición previa fue la causaLa mujer había sido tratada años antes por hipertensión intracraneal, lo que significa que la presión del líquido cefalorraquídeo que protege y nutre el cerebro era demasiado alta.Los médicos en ese momento usaron una derivación para drenar parte del líquido y la afección se resolvió. Pero hizo que desarrollara lo que se llama encefalocele, un defecto en la base del cráneo que lleva a que el revestimiento del cerebro sobresalga hacia la nariz, donde es susceptible de romperse.Esto pasó desapercibido hasta que sus nuevos médicos revisaron las viejas exploraciones y realizaron una cirugía para reparar el defecto. Desde entonces la paciente se ha recuperado por completo.Si el problema no se hubiera tratado, podría haber desarrollado una infección cerebral potencialmente fatal o podría haber entrado aire en el cráneo y ejercer una presión indebida sobre el cerebro.",[]
